<?xml version="1.0" encoding="UTF-8" ?>
<!DOCTYPE Stromx SYSTEM "stromx.dtd">

<Stromx version="0.1.0">
    <Stream>
        <Operator id="0" package="Base" type="Camera" version="0.1.0"/>
        <Operator id="1" package="Base" type="Buffer" version="0.1.0"/>
        <Operator id="2" package="Base" type="Canny" version="0.1.0">
            <Input id="0" operator="0" output="0"/>
            <Input id="1" operator="1" output="0"/>
        </Operator>
        <Thread>
            <InputConnector operator="2" input="0"/>
            <InputConnector operator="2" input="1"/>
        </Thread> 
    </Stream>
</Stromx>
