<?xml version="1.0" encoding="UTF-8" ?>
<!DOCTYPE Stromx SYSTEM "stromx.dtd">

<Stromx version="0.1.0">
    <Stream>
        <Operator id="0" package="Runtime" type="Counter" version="0.1.0"/>
        <Operator id="1" package="Runtime" type="PeriodicDelay" version="0.1.0">
            <Parameter id="0">
                <Data type="UInt32" package="Runtime" version="0.1.0">1000</Data>
            </Parameter>
            <Input id="0" operator="0" output="0"/>
        </Operator>
        <Thread>
            <InputConnector operator="1" input="0"/>
        </Thread> 
    </Stream>
</Stromx>
