<?xml version="1.0" encoding="UTF-8" ?>
<!DOCTYPE Stromx SYSTEM "stromx.dtd">

<Stromx version="0.1.0">
    <Stream name="TestStream">
        <Operator id="0" package="TestPackage" type="TestOperator" version="0.1.0" name="Number 1">
            <Parameter id="0">
                <Data type="UInt32" package="Runtime" version="0.1.0">5000</Data>
            </Parameter>
            <Parameter id="1">
                <Data type="UInt32" package="Runtime" version="0.1.0">200</Data>
            </Parameter>
            <Parameter id="2">
                <Data package="Runtime" type="Bool" version="0.1.0">0</Data>
            </Parameter>
            <Parameter id="3">
                <Data package="TestPackage" type="TestData" version="0.1.0" file="data.txt"/>
            </Parameter>
        </Operator>
        <Operator id="1" package="TestPackage" type="TestOperator" version="0.1.0" name="Number 2">
            <Parameter id="0">
                <Data type="UInt32" package="Runtime" version="0.1.0">6000</Data>
            </Parameter>
            <Parameter id="1">
                <Data type="UInt32" package="Runtime" version="0.1.0">250</Data>
            </Parameter>
            <Input id="0" operator="0" output="2"/>
            <Input id="1" operator="0" output="3"/>
        </Operator>
        <Operator id="2" package="TestPackage" type="TestOperator" version="0.1.0" name="Number 3">
            <Parameter id="0">
                <Data type="UInt32" package="Runtime" version="0.1.0">7000</Data>
            </Parameter>
            <Parameter id="1">
                <Data type="UInt32" package="Runtime" version="0.1.0">300</Data>
            </Parameter>
            <Input id="0" operator="1" output="2"/>
            <Input id="1" operator="1" output="3"/>
        </Operator>
        <Thread name="Processing thread">
            <InputConnector operator="1" input="0"/>
            <InputConnector operator="1" input="1"/>
            <InputConnector operator="2" input="0"/>
            <InputConnector operator="2" input="1"/>
        </Thread> 
    </Stream>
</Stromx>