<?xml version="1.0" encoding="UTF-8" ?>
<!DOCTYPE Stromx SYSTEM "stromx.dtd">

   <!-- validate: xmllint \-\-valid \-\-noout parameters.xml
                  (remove backslashes)
                  xmllint \-\-dtdvalid stromx.dtd \-\-noout parameters.xml
   -->

<Stromx version="0.1.0">
    <Parameters>
        <Operator id="0" package="Base" type="ConstImage" version="0.1.0" name="Source image">
            <Parameter id="0">
                <Data type="Image" package="Base" version="0.1.0">lenna.png</Data>
            </Parameter>
        </Operator>
        <Operator id="1" package="Base" type="Clip" version="0.1.0" name="Clip image">
            <Parameter id="0">
                <Data type="UInt32" package="Stream" version="0.1.0">200</Data>
            </Parameter>
            <Parameter id="1">
                <Data type="UInt32" package="Stream" version="0.1.0">210</Data>
            </Parameter>
            <Parameter id="2">
                <Data type="UInt32" package="Stream" version="0.1.0">100</Data>
            </Parameter>
            <Parameter id="3">
                <Data type="UInt32" package="Stream" version="0.1.0">90</Data>
            </Parameter>
        </Operator>
        <Operator id="2" package="Base" type="AdjustRgbChannels" version="0.1.0" name="White balance">
            <Parameter id="0">
                <Data type="Double" package="Stream" version="0.1.0">0.1</Data>
            </Parameter>
            <Parameter id="1">
                <Data type="Double" package="Stream" version="0.1.0">1.0</Data>
            </Parameter>
            <Parameter id="2">
                <Data type="Double" package="Stream" version="0.1.0">1.5</Data>
            </Parameter>
        </Operator>
        <Operator id="3" package="Base" type="AdjustRgbChannels" version="0.1.0" name="Exposure">
            <Parameter id="0">
                <Data type="Double" package="Stream" version="0.1.0">0.8</Data>
            </Parameter>
            <Parameter id="1">
                <Data type="Double" package="Stream" version="0.1.0">0.8</Data>
            </Parameter>
            <Parameter id="2">
                <Data type="Double" package="Stream" version="0.1.0">0.8</Data>
            </Parameter>
        </Operator>
    </Parameters>
</Stromx>