<?xml version="1.0" encoding="UTF-8" ?>
<!DOCTYPE Stromx SYSTEM "stromx.dtd">

   <!-- validate: xmllint \-\-valid \-\-noout stream.xml
                  (remove backslashes)
                  xmllint \-\-dtdvalid stromx.dtd \-\-noout stream.xml
   -->

<Stromx version="0.1.0">
    <Stream name="Sample stream">
        <Operator id="0" package="Base" type="ConstImage" version="0.1.0" name="Source image">
            <Parameter id="0">
                <Data type="Image" package="Base" version="0.1.0">lenna.png</Data>
            </Parameter>
        </Operator>
        <Operator id="1" package="Base" type="Clip" version="0.1.0" name="Clip image">
            <Parameter id="0">
                <Data type="UInt32" package="Stream" version="0.1.0">200</Data>
            </Parameter>
            <Parameter id="1">
                <Data type="UInt32" package="Stream" version="0.1.0">210</Data>
            </Parameter>
            <Parameter id="2">
                <Data type="UInt32" package="Stream" version="0.1.0">100</Data>
            </Parameter>
            <Parameter id="3">
                <Data type="UInt32" package="Stream" version="0.1.0">90</Data>
            </Parameter>
            <Input id="0" operator="0" output="0"/>
        </Operator>
        <Operator id="2" package="Base" type="AdjustRgbChannels" version="0.1.0" name="White balance">
            <Parameter id="0">
                <Data type="Double" package="Stream" version="0.1.0">0.1</Data>
            </Parameter>
            <Parameter id="1">
                <Data type="Double" package="Stream" version="0.1.0">1.0</Data>
            </Parameter>
            <Parameter id="2">
                <Data type="Double" package="Stream" version="0.1.0">1.5</Data>
            </Parameter>
            <Input id="0" operator="1" output="0"/>
        </Operator>
        <Operator id="3" package="Base" type="AdjustRgbChannels" version="0.1.0" name="Exposure">
            <Parameter id="0">
                <Data type="Double" package="Stream" version="0.1.0">0.8</Data>
            </Parameter>
            <Parameter id="1">
                <Data type="Double" package="Stream" version="0.1.0">0.8</Data>
            </Parameter>
            <Parameter id="2">
                <Data type="Double" package="Stream" version="0.1.0">0.8</Data>
            </Parameter>
            <Input id="0" operator="2" output="0"/>
        </Operator>
        <Thread name="First processing thread">
            <InputNode operator="1" input="0"/>
            <InputNode operator="2" input="0"/>
        </Thread> 
        <Thread name="Second processing thread">
            <InputNode operator="3" input="0"/>
        </Thread> 
    </Stream>
</Stromx>