<?xml version="1.0" encoding="UTF-8" ?>
<!DOCTYPE Stromx SYSTEM "stromx.dtd">

<Stromx version="0.1.0">
    <Stream>
        <Operator id="0" package="Base" type="Camera" version="0.1.0">
            <!-- output image index -->
            <Parameter id="0">
                <Data package="Runtime" type="Bool" version="0.1.0">1</Data>
            </Parameter>
            <!-- image for camera simulator -->
            <Parameter id="1">
                <Data type="Image" package="Base" version="0.1.0" file="lenna.jpg"/>
            </Parameter>
            <!-- software trigger mode -->
            <Parameter id="2">
                <Data type="Enum" package="Runtime" version="0.1.0">1</Data>
            </Parameter>
            <!-- the buffer size is 1 MB -->
            <Parameter id="6">
                <Data type="UInt32" package="Runtime" version="0.1.0">1000000</Data>
            </Parameter>
            <!-- one buffer -->
            <Parameter id="7">
                <Data type="UInt32" package="Runtime" version="0.1.0">1</Data>
            </Parameter>
            <!-- 8-bit grayscale output -->
            <Parameter id="15">
                <Data type="Enum" package="Runtime" version="0.1.0">1</Data>
            </Parameter>
        </Operator>
        <Operator id="1" package="Base" type="Buffer" version="0.1.0">
            <!-- one buffer -->
            <Parameter id="0">
                <Data type="UInt32" package="Runtime" version="0.1.0">1</Data>
            </Parameter>
            <!-- the buffer size is 1 MB -->
            <Parameter id="1">
                <Data type="UInt32" package="Runtime" version="0.1.0">1000000</Data>
            </Parameter>
        </Operator>
        <Operator id="2" package="Base" type="Canny" version="0.1.0">
            <!-- process in place -->
            <Parameter id="0">
                <Data type="Bool" package="Runtime" version="0.1.0">0</Data>
            </Parameter>
            <!-- threshold 1 -->
            <Parameter id="1">
                <Data type="Double" package="Runtime" version="0.1.0">50</Data>
            </Parameter>
            <!-- threshold 2 -->
            <Parameter id="2">
                <Data type="Double" package="Runtime" version="0.1.0">150</Data>
            </Parameter>
            <Input id="0" operator="0" output="0"/>
            <Input id="1" operator="1" output="0"/>
        </Operator>
        <Thread>
            <InputConnector operator="2" input="0"/>
            <InputConnector operator="2" input="1"/>
        </Thread> 
    </Stream>
</Stromx>
